{
  "$schema": "./harness/schema.json",
  "version": "4.0.0",
  "description": "Cross-language example parity manifest for nxusKit",
  "examples": [
    {
      "name": "basic-chat",
      "description": "Basic chat completion with a simple prompt",
      "category": "patterns",
      "required": true,
      "scenario": "Send a single chat message and receive a response",
      "real_world_application": "Customer support chatbot, FAQ assistant",
      "tech_tags": [
        "LLM"
      ],
      "languages": [
        "rust",
        "go",
        "python"
      ],
      "implementations": {
        "rust": "examples/patterns/basic-chat/rust",
        "go": "examples/patterns/basic-chat/go",
        "python": "examples/patterns/basic-chat/python"
      },
      "tier": "community",
      "difficulty": "starter",
      "tagline": "Send your first LLM chat message in minutes, then swap providers without touching your application code.",
      "blurb": "Build provider-agnostic chat completions from day one using nxusKit's unified LLM interface. A single consistent API wraps Claude, OpenAI, and Ollama so you can switch providers by changing a configuration value, not your code. This starter example walks through request construction, response handling, and normalized token tracking in Go, Rust, and Python, with interactive step-through and verbose modes that show exactly what travels over the wire.",
      "content_hash": "7d7796939ab185ab4e85b746e8961c2c084e8602da65563d349d9b0d2f9a0455"
    },
    {
      "name": "streaming",
      "description": "Streaming chat completion with real-time output",
      "category": "patterns",
      "required": true,
      "scenario": "Stream tokens from a chat completion as they arrive",
      "real_world_application": "Real-time chat interface, live transcription display",
      "tech_tags": [
        "LLM",
        "Streaming"
      ],
      "languages": [
        "rust",
        "go",
        "python"
      ],
      "implementations": {
        "rust": "examples/patterns/streaming/rust",
        "go": "examples/patterns/streaming/go",
        "python": "examples/patterns/streaming/python"
      },
      "tier": "community",
      "difficulty": "intermediate",
      "tagline": "Stream LLM responses token by token with a unified async interface that works across Claude, OpenAI, and Ollama without changing your code.",
      "blurb": "Display LLM responses in real time without waiting for the full completion to arrive. nxusKit normalizes the Server-Sent Event formats from Claude, OpenAI, and Ollama into a single consistent streaming interface, so you write one pattern and swap providers freely. Implementations are available in Rust, Go, and Python, each using the idiomatic concurrency primitive for that language—async Stream, channels, and iterators respectively. Structured chunk types carry delta content and finish-reason metadata, and a built-in stream_with_callback utility handles content accumulation when you need the full response alongside live output.",
      "content_hash": "0cf9c2c9d29c07beffb12eb4ab69e9c41b2645a9cd1696bf41b5e630cbdc0c55"
    },
    {
      "name": "multi-provider",
      "description": "Using multiple providers in one application",
      "category": "patterns",
      "required": true,
      "scenario": "Configure and switch between multiple LLM providers at runtime",
      "real_world_application": "Multi-vendor AI gateway, provider comparison tool",
      "tech_tags": [
        "LLM"
      ],
      "languages": [
        "rust",
        "go",
        "python"
      ],
      "implementations": {
        "rust": "examples/patterns/multi-provider/rust",
        "go": "examples/patterns/multi-provider/go",
        "python": "examples/patterns/multi-provider/python"
      },
      "tier": "community",
      "difficulty": "starter",
      "tagline": "Run the same prompt across Claude, OpenAI, and Ollama simultaneously using one unified interface that normalizes responses and token usage.",
      "blurb": "Query multiple LLM providers concurrently and compare responses through a single, normalized API. nxusKit's provider abstraction layer wraps Claude, OpenAI, and Ollama behind a shared interface, so every call returns the same ChatResponse type with consistent token usage data. Implementations in Rust, Go, and Python demonstrate the pattern using concurrent execution — goroutines, ThreadPoolExecutor, or async calls — while provider-agnostic error handling ensures one failing provider never blocks the others.",
      "content_hash": "41993861824cbc7795d75b58e12dd2894da22fa06e0c898cbcce4275889c278d"
    },
    {
      "name": "convenience-api",
      "description": "LiteLLM-style convenience API usage",
      "category": "patterns",
      "required": true,
      "scenario": "Use simplified one-liner API for quick LLM calls",
      "real_world_application": "Rapid prototyping, scripting with LLM capabilities",
      "tech_tags": [
        "LLM"
      ],
      "languages": [
        "rust",
        "go"
      ],
      "implementations": {
        "rust": "examples/patterns/convenience-api/rust",
        "go": "examples/patterns/convenience-api/go"
      },
      "tier": "community",
      "difficulty": "starter",
      "tagline": "Skip the boilerplate: call any LLM with a single line, letting nxusKit detect your provider and credentials automatically.",
      "blurb": "The convenience API gives you immediate LLM access without writing provider setup code — one function call handles routing, authentication, and streaming across OpenAI, Anthropic, and Ollama. nxusKit infers the provider from the model name, reads credentials from environment variables, and returns a response or live-streaming chunks with no additional configuration. Available in both Go and Rust, this pattern is designed for scripts, prototypes, and any context where getting to a working LLM call matters more than fine-grained provider control.",
      "content_hash": "00eb6ea66328a643f0e72b8b55b7cc04a2272741be4533b26b1462e930019ede"
    },
    {
      "name": "blocking-api",
      "description": "Synchronous blocking API for simpler use cases",
      "category": "patterns",
      "required": true,
      "scenario": "Make synchronous LLM calls without async runtime",
      "real_world_application": "CLI tools, batch processing scripts",
      "tech_tags": [
        "LLM"
      ],
      "languages": [
        "rust",
        "go"
      ],
      "implementations": {
        "rust": "examples/patterns/blocking-api/rust",
        "go": "examples/patterns/blocking-api/go"
      },
      "notes": "Rust-specific feature; Go is synchronous by default",
      "tier": "community",
      "difficulty": "starter",
      "tagline": "Call LLMs synchronously from any Rust code — no async runtime required, no await syntax, no tokio dependency to manage.",
      "blurb": "Skip the async runtime entirely and call LLMs with plain synchronous code. nxusKit's BlockingProvider wraps any provider behind a standard blocking interface, while NxuskitProvider goes further with direct C ABI calls that need no runtime whatsoever. This pattern is purpose-built for Rust, where async requires an explicit runtime — making it ideal for CLI tools, batch scripts, immediate-mode UIs, and legacy codebases. Go developers get synchronous APIs natively and can reference the basic-chat example instead.",
      "content_hash": "205d680730bf94b756e2e409e580f57f7ba5005f3fd08761abd984c26a743d62"
    },
    {
      "name": "capability-detection",
      "description": "Detecting provider capabilities at runtime",
      "category": "patterns",
      "required": true,
      "scenario": "Query provider capabilities before dispatching requests",
      "real_world_application": "Adaptive AI middleware, feature-gated UX",
      "tech_tags": [
        "LLM"
      ],
      "languages": [
        "rust",
        "go"
      ],
      "implementations": {
        "rust": "examples/patterns/capability-detection/rust",
        "go": "examples/patterns/capability-detection/go"
      },
      "tier": "community",
      "difficulty": "starter",
      "tagline": "Stop hardcoding model names — query provider capabilities at runtime and let task requirements drive model selection across any LLM backend.",
      "blurb": "Capability Detection gives you a provider-agnostic way to inspect model metadata at runtime and route requests to the right model for the job. nxusKit's ListModels API returns normalized ModelInfo — context window size, vision support, modalities — across OpenAI, Claude, and Ollama through a single consistent interface. Your code filters by what a model can do rather than what it's named, making it straightforward to build adaptive middleware or feature-gated UX that degrades gracefully as your provider lineup changes. Available in Go and Rust.",
      "content_hash": "e153b73732492d4d90ca39c56e8f797b36251704fe3e30d30dd664099725c112"
    },
    {
      "name": "cost-routing",
      "description": "Cost-aware provider routing and selection",
      "category": "patterns",
      "required": true,
      "scenario": "Route requests to cost-appropriate models based on task complexity",
      "real_world_application": "Cost-optimized inference, budget-aware model selection, prompt complexity tiering",
      "tech_tags": [
        "LLM"
      ],
      "languages": [
        "go",
        "python",
        "rust"
      ],
      "implementations": {
        "rust": "examples/patterns/cost-routing/rust",
        "go": "examples/patterns/cost-routing/go",
        "python": "examples/patterns/cost-routing/python"
      },
      "tier": "community",
      "difficulty": "starter",
      "tagline": "Route every LLM request to the right model for the job, so you stop paying premium prices for economy-grade tasks.",